[
  {
    "execution_status": "not_run",
    "question_id": "BM01",
    "question_version": "1.0.0",
    "candidate_id": "C-panel-AB",
    "context_version": "1.0.0",
    "context_hash": null,
    "answer_option_id": null,
    "probabilities": null,
    "provider_confidence": null,
    "calibrated_reliability": null,
    "calibration_id": null,
    "model_id": null,
    "model_revision": null,
    "runtime_version": null,
    "executed_at": null,
    "raw_response_location": null,
    "context_evidence_ids": [
      "BM-E1"
    ],
    "routing_action": null,
    "routing_rule_version": null,
    "error": null
  },
  {
    "execution_status": "not_run",
    "question_id": "BM02",
    "question_version": "1.0.0",
    "candidate_id": "S1-EDTA-plasma",
    "context_version": "1.0.0",
    "context_hash": null,
    "answer_option_id": null,
    "probabilities": null,
    "provider_confidence": null,
    "calibrated_reliability": null,
    "calibration_id": null,
    "model_id": null,
    "model_revision": null,
    "runtime_version": null,
    "executed_at": null,
    "raw_response_location": null,
    "context_evidence_ids": [
      "BM-E2"
    ],
    "routing_action": null,
    "routing_rule_version": null,
    "error": null
  },
  {
    "execution_status": "not_run",
    "question_id": "BM03",
    "question_version": "1.0.0",
    "candidate_id": "X3-intended-contrast",
    "context_version": "1.0.0",
    "context_hash": null,
    "answer_option_id": null,
    "probabilities": null,
    "provider_confidence": null,
    "calibrated_reliability": null,
    "calibration_id": null,
    "model_id": null,
    "model_revision": null,
    "runtime_version": null,
    "executed_at": null,
    "raw_response_location": null,
    "context_evidence_ids": [
      "BM-E3"
    ],
    "routing_action": null,
    "routing_rule_version": null,
    "error": null
  },
  {
    "execution_status": "not_run",
    "question_id": "BM02",
    "question_version": "1.0.0",
    "candidate_id": "S1-EDTA-plasma",
    "context_version": "1.0.0-missing",
    "context_hash": null,
    "answer_option_id": null,
    "probabilities": null,
    "provider_confidence": null,
    "calibrated_reliability": null,
    "calibration_id": null,
    "model_id": null,
    "model_revision": null,
    "runtime_version": null,
    "executed_at": null,
    "raw_response_location": null,
    "context_evidence_ids": [
      "biomarkers-missing"
    ],
    "routing_action": null,
    "routing_rule_version": null,
    "error": null
  },
  {
    "execution_status": "not_run",
    "question_id": "BM02",
    "question_version": "1.0.0",
    "candidate_id": "S1-EDTA-plasma",
    "context_version": "1.0.0-conflict",
    "context_hash": null,
    "answer_option_id": null,
    "probabilities": null,
    "provider_confidence": null,
    "calibrated_reliability": null,
    "calibration_id": null,
    "model_id": null,
    "model_revision": null,
    "runtime_version": null,
    "executed_at": null,
    "raw_response_location": null,
    "context_evidence_ids": [
      "BM-E2",
      "biomarkers-conflict"
    ],
    "routing_action": null,
    "routing_rule_version": null,
    "error": null
  }
]
