[
  {
    "execution_status": "not_run",
    "question_id": "GV01",
    "question_version": "1.0.0",
    "candidate_id": "V_SYN_1-D_SYN",
    "context_version": "1.0.0",
    "context_hash": null,
    "answer_option_id": null,
    "probabilities": null,
    "provider_confidence": null,
    "calibrated_reliability": null,
    "calibration_id": null,
    "model_id": null,
    "model_revision": null,
    "runtime_version": null,
    "executed_at": null,
    "raw_response_location": null,
    "context_evidence_ids": [
      "GV-E1"
    ],
    "routing_action": null,
    "routing_rule_version": null,
    "error": null
  },
  {
    "execution_status": "not_run",
    "question_id": "GV03",
    "question_version": "1.0.0",
    "candidate_id": "V_SYN_1-X2",
    "context_version": "1.0.0",
    "context_hash": null,
    "answer_option_id": null,
    "probabilities": null,
    "provider_confidence": null,
    "calibrated_reliability": null,
    "calibration_id": null,
    "model_id": null,
    "model_revision": null,
    "runtime_version": null,
    "executed_at": null,
    "raw_response_location": null,
    "context_evidence_ids": [
      "GV-E1",
      "GV-E2"
    ],
    "routing_action": null,
    "routing_rule_version": null,
    "error": null
  },
  {
    "execution_status": "not_run",
    "question_id": "GV04",
    "question_version": "1.0.0",
    "candidate_id": "T_SYN.1-X2",
    "context_version": "1.0.0",
    "context_hash": null,
    "answer_option_id": null,
    "probabilities": null,
    "provider_confidence": null,
    "calibrated_reliability": null,
    "calibration_id": null,
    "model_id": null,
    "model_revision": null,
    "runtime_version": null,
    "executed_at": null,
    "raw_response_location": null,
    "context_evidence_ids": [
      "GV-E2"
    ],
    "routing_action": null,
    "routing_rule_version": null,
    "error": null
  },
  {
    "execution_status": "not_run",
    "question_id": "GV01",
    "question_version": "1.0.0",
    "candidate_id": "V_SYN_1-D_SYN",
    "context_version": "1.0.0-missing",
    "context_hash": null,
    "answer_option_id": null,
    "probabilities": null,
    "provider_confidence": null,
    "calibrated_reliability": null,
    "calibration_id": null,
    "model_id": null,
    "model_revision": null,
    "runtime_version": null,
    "executed_at": null,
    "raw_response_location": null,
    "context_evidence_ids": [
      "variants-missing"
    ],
    "routing_action": null,
    "routing_rule_version": null,
    "error": null
  },
  {
    "execution_status": "not_run",
    "question_id": "GV01",
    "question_version": "1.0.0",
    "candidate_id": "V_SYN_1-D_SYN",
    "context_version": "1.0.0-conflict",
    "context_hash": null,
    "answer_option_id": null,
    "probabilities": null,
    "provider_confidence": null,
    "calibrated_reliability": null,
    "calibration_id": null,
    "model_id": null,
    "model_revision": null,
    "runtime_version": null,
    "executed_at": null,
    "raw_response_location": null,
    "context_evidence_ids": [
      "GV-E1",
      "variants-conflict"
    ],
    "routing_action": null,
    "routing_rule_version": null,
    "error": null
  }
]
